{
  "run_id": "run.example_001",
  "deck_id": "deck.ai_build_preflight.v0_1",
  "current_stack": "stack.intake.v0_1",
  "current_card": "check.source_inventory.v0_1",
  "status": "READY",
  "inputs": [
    "example source material"
  ],
  "outputs": [],
  "next_action": "play_current_card",
  "receipt_path": "receipts/example_receipt.md"
}
